{"bindings":[{"capabilityId":"calendar.badge.browser","haxePath":"acme.calendar.browser.CalendarBadge","id":"js.calendar.badge","kind":"react-component","nativeName":"@acme/calendar.CalendarBadge","parameters":[{"haxeName":"props","nativeName":"props","passing":"value","position":0,"requirement":"required","type":{"fields":[{"haxeName":"count","name":"count","readonly":true,"requirement":"required","type":{"kind":"javascript-number"}},{"haxeName":"label","name":"label","readonly":true,"requirement":"required","type":{"kind":"string"}}],"kind":"structure","name":"CalendarBadgeProps","target":"javascript"}}],"returnType":{"kind":"javascript-object"},"sourceEvidence":{"signatureSha256":"5fb5578ad4ceb5df8d179e3fd51e3f4e758a0a189878246bcb28fb5f1bdd2c05","spans":[{"endByte":234,"inputId":"browser-types","path":"fixtures/adoption-contract/inputs/index.d.ts","sha256":"9d16cafcbdcdc2d4d843ea3aae50f208462278e4d1ed1ddbb7cb2c25d61fbf6f","startByte":161},{"endByte":91,"inputId":"browser-types","path":"fixtures/adoption-contract/inputs/index.d.ts","sha256":"13e256734e3e9ff40205c0d7abd397eb5cf307a823a8585f878751c0bb424463","startByte":0},{"endByte":403,"inputId":"browser-runtime","path":"fixtures/adoption-contract/inputs/index.js","sha256":"2b985805631a47602e28a3ee2fdb5cf42a6e4d19cc79cab98c5c2ce1670b6c57","startByte":365}]},"sourceInputId":"browser-types","status":"admitted-precise","target":"javascript"},{"capabilityId":"calendar.badge.browser","haxePath":"acme.calendar.browser.CalendarLabels.format","id":"js.calendar.format-label","kind":"module-function","nativeName":"@acme/calendar.formatCalendarLabel","parameters":[{"haxeName":"count","nativeName":"count","passing":"value","position":0,"requirement":"required","type":{"kind":"javascript-number"}}],"returnType":{"kind":"string"},"sourceEvidence":{"signatureSha256":"ad90b0d45a69e9b83990186b5ea8529fc669797f72a46350d8b66bce37178726","spans":[{"endByte":160,"inputId":"browser-types","path":"fixtures/adoption-contract/inputs/index.d.ts","sha256":"6bc6ae103a6d8ce245695052203fcb3d6b25fb77538d72bb6c81a0a7e65c008b","startByte":93},{"endByte":245,"inputId":"browser-runtime","path":"fixtures/adoption-contract/inputs/index.js","sha256":"ccd9e64a0209b60c2fc358143dc6507d72522c73bceda9bb94301240296f4d61","startByte":201}]},"sourceInputId":"browser-types","status":"admitted-precise","target":"javascript"},{"capabilityId":"calendar.read.php","haxePath":"acme.calendar.server.Event.create","id":"php.calendar.event.construct","kind":"constructor","nativeName":"Acme\\Calendar\\Event::__construct","parameters":[{"haxeName":"eventTitle","nativeName":"eventTitle","passing":"value","position":0,"requirement":"required","type":{"kind":"string"}}],"returnType":{"kind":"native-nominal","name":"Acme\\Calendar\\Event","target":"php"},"sourceEvidence":{"signatureSha256":"8fba4c8f74402fb36cfbb5bcd44069e707eb4e0f40e9fe860c486938bf6c4965","spans":[{"endByte":132,"inputId":"php-stubs","path":"fixtures/adoption-contract/inputs/provider-stubs.php","sha256":"79341e282404421e72f0b857e2a1cbf4fa8e2d45ab8e3c8e60403822f2141733","startByte":79},{"endByte":360,"inputId":"plugin-source","path":"fixtures/adoption-contract/inputs/plugin.php","sha256":"480f571c409552521af5cd6c411160bc9f45ecc6895839bf34268e0612a328f6","startByte":299}]},"sourceInputId":"php-stubs","status":"admitted-precise","target":"php"},{"capabilityId":"calendar.read.php","haxePath":"acme.calendar.server.Event.title","id":"php.calendar.event.title","kind":"instance-method","nativeName":"Acme\\Calendar\\Event::title","parameters":[],"returnType":{"kind":"string"},"sourceEvidence":{"signatureSha256":"33a42daa694ef88c64b8bfe5bd8dccfe7c14991aed0340f35e85d6b99f8dde39","spans":[{"endByte":172,"inputId":"php-stubs","path":"fixtures/adoption-contract/inputs/provider-stubs.php","sha256":"3ea55c22aa074d4dcf706f9065745f3e16e84d6ffc2f2f302fb163d3db74e963","startByte":134},{"endByte":404,"inputId":"plugin-source","path":"fixtures/adoption-contract/inputs/plugin.php","sha256":"e3710b17ea001786e1daadb6c34c2d8d66886a6d99a2bfa7cc9e277823075c3e","startByte":362}]},"sourceInputId":"php-stubs","status":"admitted-precise","target":"php"},{"capabilityId":"calendar.read.php","haxePath":"acme.calendar.server.CalendarEvents.list","id":"php.calendar.list-events","kind":"function","nativeName":"Acme\\Calendar\\list_events","parameters":[{"haxeName":"limit","nativeName":"limit","passing":"value","position":0,"requirement":"required","type":{"kind":"php-int"}}],"returnType":{"kind":"list","value":{"kind":"native-nominal","name":"Acme\\Calendar\\Event","target":"php"}},"sourceEvidence":{"signatureSha256":"f755d05f4fd695f4b335ac8e7647df809fb02ead54d7794a46524871f5535016","spans":[{"endByte":315,"inputId":"php-stubs","path":"fixtures/adoption-contract/inputs/provider-stubs.php","sha256":"f5da86afbd877c9b365cea3c9b0c7b20867572aa7f74da8251cb4134751e15e1","startByte":247},{"endByte":645,"inputId":"plugin-source","path":"fixtures/adoption-contract/inputs/plugin.php","sha256":"fed90b70bd372c93b62821a8a750b295bb84f35b8d38f9780255f52ea893998c","startByte":577}]},"sourceInputId":"php-stubs","status":"admitted-precise","target":"php"}],"capabilitySet":{"id":"acme-calendar.capabilities","version":"1.0.0"},"contractDigest":"2bee55b75ab4f7edb1b7b0731103b29de7a8d16a39fcb2f3ccb7b336e961e8f2","contractId":"acme-calendar.wp70","contractVersion":"1.0.0","generation":{"generator":{"id":"wordpress-hx-adoption-generator","sha256":"b99ca3e894376ed40c47c206cf53d037b9cf842aa9d543f2d3c7d01e4bcb0825","version":"0.0.0-fixture"},"inputs":[{"authorityClass":"package-or-source-signature","executed":false,"id":"browser-runtime","kind":"provider-runtime-source","path":"fixtures/adoption-contract/inputs/index.js","precedence":3,"sha256":"9228805f03547e088b0a96a581dfcab823fccd8a4c2a4dd810764972a76d1710","target":"javascript"},{"authorityClass":"authoritative-signature","executed":false,"id":"browser-types","kind":"typescript-declaration","path":"fixtures/adoption-contract/inputs/index.d.ts","precedence":1,"sha256":"a8743a04676ab6c0331e81cbbf138ea6be11689baa32e17c0bfe549b8099bdc1","target":"javascript"},{"authorityClass":"package-or-source-signature","executed":false,"id":"package-metadata","kind":"package-metadata","path":"fixtures/adoption-contract/inputs/package-metadata.json","precedence":3,"sha256":"eb0e484d9bb26022868a4f13d8bb53d887d8f5a2c3861308e339c1fdf9f09d1f","target":"provider"},{"authorityClass":"authoritative-signature","executed":false,"id":"php-stubs","kind":"provider-stub","path":"fixtures/adoption-contract/inputs/provider-stubs.php","precedence":1,"sha256":"91156707635e2ef9122db246ad9930c865534d5f37093635fa79c56006432e17","target":"php"},{"authorityClass":"package-or-source-signature","executed":false,"id":"plugin-source","kind":"provider-runtime-source","path":"fixtures/adoption-contract/inputs/plugin.php","precedence":3,"sha256":"8d87130bc484658004329fcdf7b603d82f697b49169d119c05758e0ac014d203","target":"wordpress"}],"mergePolicy":"one-complete-binding-from-highest-nonconflicting-authority","mode":"static-no-execution","reflection":null},"ownership":{"applicationLogic":"haxe-authored","compilerRecognition":"generic-contract-only-no-provider-name-branches","contract":"cli-owned-generated","modifiedGeneratedFile":"fail-closed-no-overwrite-or-delete","providerRuntime":"external-native-provider","regeneration":"private-stage-deterministic-diff-before-publication","removal":"manifest-owned-complete-content-bundle-provider-source-untouched"},"profile":{"catalogRevision":"wp70-release/catalog-v1","catalogSha256":"d86d1d887f1a3d8894831e3ec092201ee5caba57e88f4eeff59816d22dd9aa6e","id":"wp70-release"},"provider":{"artifactFormat":"deterministic-fixture-zip-v1","artifactSha256":"923412beee77cce43964a12358bb099ac07014bd37973df9910de3ad15b9cabd","artifactUrl":"https://example.test/acme-calendar/acme-calendar.2.4.1.zip","id":"acme-calendar","implementationOwnership":"external-not-transferred","kind":"wordpress-plugin","runtimeOwner":"native-provider","sourceRevision":"fixture-acme-calendar-2.4.1","sourceSha256":"569bf6cb9a3af1d2c10d9baa7e69459925ed8dbf5226c0a4642597a9f3606002","sourceUrl":"https://example.test/acme-calendar/source/2.4.1","version":"2.4.1"},"schema":"wordpress-hx.adoption-contract.v1","schemaVersion":1}
